,No,Time,Source,Destination,Protocol,Length,Info
96,97,3.160598,192.168.1.151,213.57.2.5,DNS,127,Standard query 0x7bfe A https://dyndnss.net/
101,102,3.179447,192.168.1.151,192.168.1.1,DNS,127,Standard query 0x7bff A https://dyndnss.net/
105,106,3.199473,192.168.1.151,213.57.2.5,DNS,127,Standard query 0x7c00 A https://dyndnss.net/
110,111,3.21645,192.168.1.151,192.168.1.1,DNS,127,Standard query 0x7c01 A https://dyndnss.net/
114,115,3.233995,192.168.1.151,213.57.2.5,DNS,127,Standard query 0x7c02 A https://dyndnss.net/
118,119,3.251424,192.168.1.151,192.168.1.1,DNS,127,Standard query 0x7c03 A \\270{tps://dyndnss.net/
119,120,3.251491,192.168.1.151,192.168.1.1,DNS,127,Standard query 0x7c03 A https://dyndnss.net/
120,121,3.251822,192.168.1.151,192.168.1.1,DNS,127,Standard query 0x7c03 A https://dyndnss.net/
125,126,3.2824519999999997,192.168.1.151,213.57.2.5,DNS,127,Standard query 0x7c04 A https://dyndnss.net/[Malformed Packet]
165,166,3.3414589999999995,192.168.1.151,192.168.1.1,DNS,127,Standard query 0x7107 A https://dyndnss.net/
599,600,13.462022,192.168.1.119,192.168.1.112,TCP,115,"443  >  46142 [SYN, ACK] Seq=0 Ack=1 Win=29200 Len=0 MSS=1460 SACK_PERM=1 WS=8"
615,616,13.468206,192.168.1.119,192.168.1.112,TCP,109,443  >  46142 [ACK] Seq=1 Ack=438 Win=30272 Len=0
617,618,13.471354999999999,192.168.1.119,192.168.1.112,TLSv1.2,240,"Server Hello, Change Cipher Spec, Encrypted Handshake Message"
640,641,13.478116,192.168.1.119,192.168.1.112,TCP,109,443  >  46142 [ACK] Seq=138 Ack=653 Win=30272 Len=0
646,647,13.506673999999999,192.168.1.119,192.168.1.112,TCP,1563,443  >  46142 [ACK] Seq=138 Ack=653 Win=30272 Len=1460 [TCP segment of a reassembled PDU]
653,654,13.515537,192.168.1.119,192.168.1.112,TLSv1.2,781,Application Data
657,658,13.520473999999998,192.168.1.119,192.168.1.112,TCP,137,"443  >  46142 [RST, ACK, ECN] Seq=2276 Ack=653 Win=159768 Len=34"
659,660,13.522331,192.168.1.119,192.168.1.112,TCP,137,"[TCP Retransmission] 443  >  46142 [PSH, ACK] Seq=2276 Ack=653 Win=30272 Len=34"
699,700,13.588422,192.168.1.151,213.57.2.5,DNS,127,Standard query 0x7c0e A https://dyndnss.net/
723,724,13.609751000000001,192.168.1.151,192.168.1.1,DNS,127,Standard query 0x7c0f A https://dyndnss.net/
763,764,13.686117000000001,192.168.1.151,192.168.1.1,DNS,127,Standard query 0x7c13 A https://dyndnss.net/
805,806,13.809353,192.168.1.151,213.57.2.5,DNS,127,Standard query 0x7c14 A https://dyndnss.net/
806,807,13.809631,192.168.1.151,213.57.2.5,DNS,127,Standard query 0x7c14 A https://dyndnss.net/
807,808,13.810149,192.168.1.151,213.57.2.5,DNS,127,Standard query 0x7c14 A https://dyndnss.net/
808,809,13.811897,192.168.1.151,213.57.2.5,DNS,127,Standard query 0x7c14 A https://dyndnss.net/
845,846,13.835033,192.168.1.151,213.57.2.5,DNS,127,Standard query 0x7c14 A https://dyndnss.net/
870,871,13.848420999999998,192.168.1.119,192.168.1.112,TCP,1563,443  >  46142 [ACK] Seq=2310 Ack=810 Win=30272 Len=1460 [TCP segment of a reassembled PDU]
871,872,13.851244,192.168.1.119,192.168.1.112,TCP,1563,[TCP Retransmission] 443  >  46142 [ACK] Seq=2310 Ack=810 Win=30272 Len=1460
872,873,13.854201999999999,192.168.1.119,192.168.1.112,TCP,1563,[TCP Retransmission] 443  >  46142 [ACK] Seq=2310 Ack=810 Win=30272 Len=1460
874,875,13.866983,192.168.1.119,192.168.1.112,TCP,1563,443  >  46142 [ACK] Seq=3770 Ack=810 Win=30272 Len=1460 [TCP segment of a reassembled PDU]
878,879,13.878901,192.168.1.119,192.168.1.112,TLSv1.2,1400,Application Data
893,894,13.892767000000001,192.168.1.119,192.168.1.112,TCP,1563,443  >  46142 [ACK] Seq=6527 Ack=810 Win=30272 Len=1460 [TCP segment of a reassembled PDU]
895,896,13.900416,192.168.1.119,192.168.1.112,TLSv1.2,906,Application Data
902,903,13.904457999999998,192.168.1.119,192.168.1.112,TLSv1.2,137,Application Data
913,914,13.918625,192.168.1.119,192.168.1.112,TCP,137,"[TCP Retransmission] 443  >  46142 [PSH, ACK] Seq=8790 Ack=810 Win=30272 Len=34"
969,970,14.005370000000001,192.168.1.151,213.57.2.5,DNS,127,Standard query 0x7c1a Unknown (12402) https://dyndnss.net/[Malformed Packet]
